{
  "$id": "https://raw.githubusercontent.com/solargis/schemas/v1.1.10/solargis_public_TS_request.schema.json",
  "$schema": "http://json-schema.org/draft-07/schema",

  "description": "Schema for Solargis data request - for timeseries datasets.",
  "type": "object",
  "required": [
    "site",
    "timeStep",
    "fromDate",
    "toDate",
    "columns",
    "outputFormat"
  ],
  "additionalProperties": true,
  "properties": {
    "site": {
      "description": "Site location definition.",
      "$ref": "solargis_data_request.schema.json#/$defs/DataRequest/properties/site"
    },
    "timeStep": {
      "type": "string",
      "enum": [
        "PT15M",
        "PT30M",
        "PT60M",
        "P1D",
        "P1M",
        "P1Y"
      ]
    },
    "fromDate": {
      "description": "Start date of the requested data. Inclusive.",
      "$ref": "solargis_data_request.schema.json#/$defs/DataRequest/properties/fromDate"
    },
    "toDate": {
      "description": "End date of the requested data. Inclusive.",
      "$ref": "solargis_data_request.schema.json#/$defs/DataRequest/properties/toDate"
    },
    "columns": {
      "$ref": "solargis_data_request.schema.json#/$defs/DataRequest/properties/columns"
    },
    "utcOffset": {
      "$ref": "solargis_data_request.schema.json#/$defs/DataRequest/properties/utcOffset"
    },
    "timeAlignment": {
      "$ref": "solargis_data_request.schema.json#/$defs/DataRequest/properties/timeAlignment"
    },
    "terrainShading": {
      "$ref": "solargis_data_request.schema.json#/$defs/DataRequest/properties/terrainShading"
    },
    "environment": {
      "$ref": "solargis_data_request.schema.json#/$defs/DataRequest/properties/environment"
    },
    "gtiConfiguration": {
      "$ref": "solargis_data_request.schema.json#/$defs/DataRequest/properties/gtiConfiguration"
    },
    "pvConfiguration": {
      "description": "Object is required if at least one PV output related column is present in the array of requested columns (PVOUT*, TMOD).",
      "$ref": "solargis_data_request.schema.json#/$defs/DataRequest/properties/pvConfiguration"
    },
    "fileLabel": {
      "$ref": "solargis_common_types.schema.json#/$defs/FileLabel"
    },
    "outputFormat": {
      "$ref": "solargis_data_request.schema.json#/$defs/DataRequest/properties/outputFormat"
    },
    "outputRoundingLevel": {
      "$ref": "solargis_data_request.schema.json#/$defs/DataRequest/properties/outputRoundingLevel"
    },
    "compressOutput": {
      "description": "Output dataset file will be zipped.",
      "type": "boolean",
      "default": false
    },
    "stochasticGenerator": {
      "$ref": "solargis_data_request.schema.json#/$defs/DataRequest/properties/stochasticGenerator"
    },
    "splitOutputByYears": {
      "description": "Process can return multiple dataset files, one file per one year. Instead of providing single dataset.",
      "type": "boolean",
      "default": false
    },
    "forecastBlendingScheme": {
      "$ref": "solargis_data_request.schema.json#/$defs/DataRequest/properties/forecastBlendingScheme"
    },
    "includeForecastModelColumns": {
      "$ref": "solargis_data_request.schema.json#/$defs/DataRequest/properties/includeForecastModelColumns"
    },
    "historicalForecast": {
      "description": "Not accepted in this request. Historical forecast is requested with solargis_public_TS_historical_forecast_request.schema.json.",
      "not": {}
    }
  },
  "$comment": "The mounting of the PV system is a part of pvConfiguration, so a separate gtiConfiguration would be ambiguous. Same rule as in solargis_data_request.schema.json.",
  "if": {
    "required": [
      "pvConfiguration"
    ]
  },
  "then": {
    "not": {
      "required": [
        "gtiConfiguration"
      ]
    }
  }
}