{
  "site": {
    "latitude": 48.15,
    "longitude": 17.11
  },
  "timeStep": "PT15M",
  "fromDate": "2026-03-01",
  "toDate": "2026-03-31",
  "utcOffset": "+01:00",
  "columns": [
    "GHI"
  ],
  "outputFormat": "SOLARGIS_JSON",
  "historicalForecast": {
    "type": "CONCATENATED",
    "leadPeriods": [
      "P0D"
    ],
    "processingTime": "08:30+01:00",
    "sources": [
      "NWP_FORECAST",
      "NOWCAST"
    ]
  }
}
