{
  "site": {
    "latitude": 43.023903,
    "longitude": 142.419596,
    "elevation": 156.9,
    "name": "Pippu 比布町, Kamikawa District",
    "countryName": "Japan",
    "countryISOCode": "JP"
  },
  "timeStep": "PT15M",
  "columns": [
    "CI_FLAG",
    "DIF",
    "DIF_NOSHD",
    "DNI",
    "DNI_NOSHD",
    "GHI",
    "GHI_C",
    "GHI_NOSHD",
    "GTI",
    "GTI_C",
    "GTI_CIRC",
    "GTI_CIRC_NOSHD",
    "GTI_DIR",
    "GTI_DIR_NOSHD",
    "GTI_ISO_HOR",
    "GTI_ISO_HOR_NOSHD",
    "GTI_NOSHD",
    "GTI_REFL",
    "GTI_REFL_NOSHD",
    "GTI_UNC_HIGH",
    "GTI_UNC_LOW",
    "PANEL_AZIMUTH",
    "PANEL_INC",
    "PANEL_TILT",
    "SUN_AZIMUTH",
    "SUN_ELEVATION"
  ],
  "fromDate": "2022-10-01",
  "toDate": "2022-10-02",
  "utcOffset": "+09:00",
  "timeAlignment": "CENTER",
  "terrainShading": true,
  "fileLabel": "Pippu_AX_987JP",
  "environment": {
    "surfaceAlbedo": 0.12,
    "horizon": {
      "azimuth": [
        0,
        37.5,
        60,
        82.5,
        105,
        127.5,
        150,
        172.5,
        195,
        217.5,
        240,
        262.5,
        285,
        307.5,
        330,
        352.5
      ],
      "height": [
        0.705,
        1.0588235,
        1.058894,
        1.428,
        0.70588764,
        0,
        0,
        0,
        0,
        0,
        0,
        0,
        0,
        0,
        0,
        0
      ]
    }
  },
  "gtiConfiguration": {
    "layout": {
      "azimuth": 180,
      "mounting": {
        "type": "FIXED_ONE_ANGLE_SEASONAL",
        "tilt": [
          {
            "dateOfChange": "03-21",
            "tilt": 30
          },
          {
            "dateOfChange": "09-21",
            "tilt": 50
          }
        ]
      }
    }
  },
  "outputFormat": "SOLARGIS_JSON",
  "stochasticGenerator": false,
  "compressOutput": false
}